pipeline/prospectus_pipeline/data/market/aftermarket/hk00068.json

[{"date": "2026-04-17", "open": 20.7, "close": 18.6, "high": 21.86, "low": 16.5, "volume": 134488211.0, "turnover": 2590288990.0, "turnover_estimated": false}, {"date": "2026-04-20", "open": 19.46, "close": 37.44, "high": 39.5, "low": 18.66, "volume": 134303615.0, "turnover": 3976138440.0, "turnover_estimated": false}, {"date": "2026-04-21", "open": 37.0, "close": 38.8, "high": 48.5, "low": 32.28, "volume": 87816145.0, "turnover": 3467606320.0, "turnover_estimated": false}, {"date": "2026-04-22", "open": 39.68, "close": 37.4, "high": 40.0, "low": 36.78, "volume": 18766041.0, "turnover": 714280180.0, "turnover_estimated": false}, {"date": "2026-04-23", "open": 38.08, "close": 30.38, "high": 39.9, "low": 30.3, "volume": 32097786.0, "turnover": 1091136740.0, "turnover_estimated": false}, {"date": "2026-04-24", "open": 30.8, "close": 28.48, "high": 32.88, "low": 27.0, "volume": 26670134.0, "turnover": 784018630.0, "turnover_estimated": false}, {"date": "2026-04-27", "open": 29.06, "close": 24.56, "high": 29.2, "low": 24.06, "volume": 22860446.0, "turnover": 586320610.0, "turnover_estimated": false}, {"date": "2026-04-28", "open": 24.0, "close": 25.0, "high": 29.12, "low": 22.5, "volume": 39411230.0, "turnover": 1021557410.0, "turnover_estimated": false}, {"date": "2026-04-29", "open": 25.0, "close": 23.22, "high": 25.9, "low": 23.0, "volume": 14778027.0, "turnover": 352640040.0, "turnover_estimated": false}, {"date": "2026-04-30", "open": 23.5, "close": 22.76, "high": 24.5, "low": 22.1, "volume": 9948167.0, "turnover": 226415390.0, "turnover_estimated": false}, {"date": "2026-05-04", "open": 23.5, "close": 27.0, "high": 27.7, "low": 23.3, "volume": 29894210.0, "turnover": 783881390.0, "turnover_estimated": false}, {"date": "2026-05-05", "open": 27.0, "close": 24.68, "high": 27.0, "low": 24.32, "volume": 14379885.0, "turnover": 363510600.0, "turnover_estimated": false}, {"date": "2026-05-06", "open": 25.38, "close": 24.32, "high": 25.46, "low": 23.54, "volume": 9340778.0, "turnover": 224452400.00000003, "turnover_estimated": false}, {"date": "2026-05-07", "open": 24.6, "close": 25.56, "high": 26.54, "low": 24.04, "volume": 13527047.0, "turnover": 340294900.0, "turnover_estimated": false}, {"date": "2026-05-08", "open": 25.6, "close": 24.9, "high": 26.42, "low": 24.6, "volume": 9237681.0, "turnover": 234711860.00000003, "turnover_estimated": false}, {"date": "2026-05-11", "open": 25.58, "close": 24.34, "high": 25.66, "low": 24.16, "volume": 5282202.0, "turnover": 129758950.0, "turnover_estimated": false}, {"date": "2026-05-12", "open": 24.6, "close": 22.7, "high": 24.86, "low": 22.44, "volume": 8451067.0, "turnover": 194806990.0, "turnover_estimated": false}, {"date": "2026-05-13", "open": 22.7, "close": 22.18, "high": 22.7, "low": 21.3, "volume": 9576459.0, "turnover": 209558100.0, "turnover_estimated": false}, {"date": "2026-05-14", "open": 22.56, "close": 21.48, "high": 22.9, "low": 21.48, "volume": 7043724.0, "turnover": 152312120.0, "turnover_estimated": false}, {"date": "2026-05-15", "open": 21.6, "close": 19.8, "high": 21.6, "low": 19.56, "volume": 7799273.0, "turnover": 155956930.0, "turnover_estimated": false}, {"date": "2026-05-18", "open": 19.77, "close": 19.35, "high": 20.3, "low": 18.72, "volume": 7547347.0, "turnover": 144526150.0, "turnover_estimated": false}, {"date": "2026-05-19", "open": 19.6, "close": 18.51, "high": 21.08, "low": 18.3, "volume": 8438085.0, "turnover": 164527220.00000003, "turnover_estimated": false}, {"date": "2026-05-20", "open": 18.86, "close": 19.15, "high": 19.96, "low": 17.58, "volume": 9058110.0, "turnover": 171203940.0, "turnover_estimated": false}, {"date": "2026-05-21", "open": 19.9, "close": 17.26, "high": 20.26, "low": 17.1, "volume": 6469010.0, "turnover": 117906440.0, "turnover_estimated": false}, {"date": "2026-05-22", "open": 17.34, "close": 18.85, "high": 19.66, "low": 16.8, "volume": 9968897.0, "turnover": 183179830.0, "turnover_estimated": false}, {"date": "2026-05-26", "open": 17.5, "close": 19.08, "high": 19.63, "low": 17.1, "volume": 8243918.0, "turnover": 152777910.0, "turnover_estimated": false}, {"date": "2026-05-27", "open": 19.4, "close": 22.34, "high": 23.5, "low": 19.22, "volume": 23666225.0, "turnover": 524506780.0, "turnover_estimated": false}, {"date": "2026-05-28", "open": 22.08, "close": 20.34, "high": 22.44, "low": 20.2, "volume": 8125868.0, "turnover": 171476280.0, "turnover_estimated": false}, {"date": "2026-05-29", "open": 20.34, "close": 18.86, "high": 21.56, "low": 18.6, "volume": 7518756.0, "turnover": 148043650.0, "turnover_estimated": false}, {"date": "2026-06-01", "open": 19.5, "close": 18.75, "high": 19.97, "low": 18.5, "volume": 4744244.0, "turnover": 90699869.99999999, "turnover_estimated": false}, {"date": "2026-06-02", "open": 18.75, "close": 19.56, "high": 20.1, "low": 18.17, "volume": 5010300.0, "turnover": 96723640.0, "turnover_estimated": false}, {"date": "2026-06-03", "open": 19.56, "close": 19.52, "high": 20.38, "low": 19.03, "volume": 4117750.0, "turnover": 81193200.0, "turnover_estimated": false}, {"date": "2026-06-04", "open": 19.27, "close": 17.98, "high": 19.27, "low": 17.9, "volume": 4372500.0, "turnover": 80612690.0, "turnover_estimated": false}, {"date": "2026-06-05", "open": 17.98, "close": 17.2, "high": 18.28, "low": 17.17, "volume": 3895740.0, "turnover": 68358050.0, "turnover_estimated": false}, {"date": "2026-06-08", "open": 16.51, "close": 15.1, "high": 16.8, "low": 14.71, "volume": 9308907.0, "turnover": 143497500.0, "turnover_estimated": false}, {"date": "2026-06-09", "open": 15.5, "close": 15.67, "high": 16.21, "low": 15.26, "volume": 3843938.0, "turnover": 60802720.0, "turnover_estimated": false}, {"date": "2026-06-10", "open": 15.6, "close": 14.92, "high": 15.8, "low": 14.43, "volume": 3573240.0, "turnover": 53283909.99999999, "turnover_estimated": false}, {"date": "2026-06-11", "open": 14.82, "close": 14.75, "high": 15.08, "low": 14.3, "volume": 2282150.0, "turnover": 33273490.0, "turnover_estimated": false}, {"date": "2026-06-12", "open": 15.1, "close": 14.6, "high": 15.46, "low": 14.35, "volume": 2631759.0, "turnover": 39239030.0, "turnover_estimated": false}, {"date": "2026-06-15", "open": 15.0, "close": 15.48, "high": 15.8, "low": 14.77, "volume": 3116175.0, "turnover": 47721280.0, "turnover_estimated": false}, {"date": "2026-06-16", "open": 15.48, "close": 14.8, "high": 15.56, "low": 14.6, "volume": 1714141.0, "turnover": 25284260.0, "turnover_estimated": false}, {"date": "2026-06-17", "open": 14.68, "close": 13.75, "high": 14.68, "low": 13.7, "volume": 3990211.0, "turnover": 55868510.0, "turnover_estimated": false}, {"date": "2026-06-18", "open": 13.77, "close": 14.2, "high": 14.36, "low": 13.35, "volume": 3029380.0, "turnover": 42398650.0, "turnover_estimated": false}, {"date": "2026-06-22", "open": 14.2, "close": 13.26, "high": 14.38, "low": 13.0, "volume": 4515365.0, "turnover": 60896590.0, "turnover_estimated": false}, {"date": "2026-06-23", "open": 13.02, "close": 12.3, "high": 13.2, "low": 12.05, "volume": 4412107.0, "turnover": 54686260.0, "turnover_estimated": false}, {"date": "2026-06-24", "open": 12.28, "close": 12.25, "high": 12.68, "low": 11.9, "volume": 2545348.0, "turnover": 31012560.0, "turnover_estimated": false}, {"date": "2026-06-25", "open": 12.25, "close": 12.0, "high": 12.25, "low": 11.58, "volume": 2639378.0, "turnover": 31094300.0, "turnover_estimated": false}, {"date": "2026-06-26", "open": 11.9, "close": 11.21, "high": 11.9, "low": 11.04, "volume": 2983099.0, "turnover": 33475540.0, "turnover_estimated": false}, {"date": "2026-06-29", "open": 11.2, "close": 11.7, "high": 11.89, "low": 11.2, "volume": 2289245.0, "turnover": 26585710.0, "turnover_estimated": false}, {"date": "2026-06-30", "open": 11.7, "close": 11.55, "high": 11.8, "low": 11.0, "volume": 2316260.0, "turnover": 26453620.0, "turnover_estimated": false}, {"date": "2026-07-02", "open": 12.0, "close": 10.12, "high": 12.0, "low": 10.02, "volume": 4441415.0, "turnover": 46595350.0, "turnover_estimated": false}, {"date": "2026-07-03", "open": 10.05, "close": 10.9, "high": 11.3, "low": 10.04, "volume": 3792137.0, "turnover": 41424880.0, "turnover_estimated": false}, {"date": "2026-07-06", "open": 10.9, "close": 10.15, "high": 10.97, "low": 9.9, "volume": 2106120.0, "turnover": 21468350.0, "turnover_estimated": false}, {"date": "2026-07-07", "open": 10.16, "close": 10.34, "high": 10.84, "low": 10.06, "volume": 2065446.0, "turnover": 21517020.000000004, "turnover_estimated": false}, {"date": "2026-07-08", "open": 10.19, "close": 11.03, "high": 11.11, "low": 10.03, "volume": 2307051.0, "turnover": 24809430.000000004, "turnover_estimated": false}, {"date": "2026-07-09", "open": 11.03, "close": 10.64, "high": 11.46, "low": 10.42, "volume": 2222500.0, "turnover": 24057990.0, "turnover_estimated": false}, {"date": "2026-07-10", "open": 10.88, "close": 10.08, "high": 10.88, "low": 10.03, "volume": 1613720.0, "turnover": 16800550.0, "turnover_estimated": false}, {"date": "2026-07-13", "open": 10.15, "close": 9.08, "high": 10.2, "low": 9.02, "volume": 3544670.0, "turnover": 33181020.0, "turnover_estimated": false}, {"date": "2026-07-14", "open": 9.0, "close": 8.84, "high": 9.0, "low": 8.45, "volume": 2467392.0, "turnover": 21465369.999999996, "turnover_estimated": false}, {"date": "2026-07-15", "open": 8.9, "close": 9.21, "high": 9.53, "low": 8.89, "volume": 1921180.0, "turnover": 17802990.0, "turnover_estimated": false}, {"date": "2026-07-16", "open": 9.21, "close": 9.81, "high": 9.98, "low": 9.21, "volume": 1834360.0, "turnover": 17838590.0, "turnover_estimated": false}, {"date": "2026-07-17", "open": 9.81, "close": 8.08, "high": 9.81, "low": 8.04, "volume": 3767110.0, "turnover": 31653320.0, "turnover_estimated": false}, {"date": "2026-07-20", "open": 8.08, "close": 8.06, "high": 8.4, "low": 8.0, "volume": 1744236.0, "turnover": 14223930.0, "turnover_estimated": false}, {"date": "2026-07-21", "open": 8.1, "close": 8.88, "high": 8.88, "low": 7.9, "volume": 3266990.0, "turnover": 27885550.0, "turnover_estimated": false}, {"date": "2026-07-22", "open": 8.98, "close": 8.3, "high": 9.26, "low": 8.28, "volume": 2070260.0, "turnover": 17953670.0, "turnover_estimated": false}, {"date": "2026-07-23", "open": 8.31, "close": 8.62, "high": 8.96, "low": 8.3, "volume": 1220660.0, "turnover": 10595320.0, "turnover_estimated": false}, {"date": "2026-07-24", "open": 8.62, "close": 8.16, "high": 8.62, "low": 8.03, "volume": 1133030.0, "turnover": 9277790.0, "turnover_estimated": false}, {"date": "2026-07-27", "open": 8.18, "close": 8.49, "high": 8.68, "low": 8.0, "volume": 1256090.0, "turnover": 10490390.0, "turnover_estimated": false}, {"date": "2026-07-28", "open": 8.35, "close": 7.82, "high": 8.46, "low": 7.81, "volume": 2297000.0, "turnover": 18380930.0, "turnover_estimated": false}, {"date": "2026-07-29", "open": 7.8, "close": 7.82, "high": 8.21, "low": 7.6, "volume": 2078550.0, "turnover": 16194580.0, "turnover_estimated": false}, {"date": "2026-07-30", "open": 7.83, "close": 7.4, "high": 8.0, "low": 7.4, "volume": 1679736.0, "turnover": 12725080.0, "turnover_estimated": false}, {"date": "2026-07-31", "open": 7.7, "close": 8.0, "high": 8.23, "low": 7.7, "volume": 2866140.0, "turnover": 23013040.0, "turnover_estimated": false}, {"date": "2026-08-03", "open": 8.01, "close": 8.39, "high": 8.57, "low": 7.97, "volume": 2278200.0, "turnover": 19034420.0, "turnover_estimated": false}, {"date": "2026-08-04", "open": 8.55, "close": 8.675, "high": 8.815, "low": 8.485, "volume": 2447500.0, "turnover": 21296900.0, "turnover_estimated": false}, {"date": "2026-08-05", "open": 8.72, "close": 9.365, "high": 9.8, "low": 8.72, "volume": 3756226.0, "turnover": 35583690.0, "turnover_estimated": false}, {"date": "2026-08-06", "open": 9.365, "close": 9.26, "high": 10.31, "low": 9.08, "volume": 3412466.0, "turnover": 32785730.0, "turnover_estimated": false}, {"date": "2026-08-07", "open": 9.3, "close": 9.8, "high": 10.38, "low": 9.18, "volume": 4363000.0, "turnover": 43357870.0, "turnover_estimated": false}, {"date": "2026-08-10", "open": 9.98, "close": 9.8, "high": 10.24, "low": 9.45, "volume": 2095400.0, "turnover": 20606770.0, "turnover_estimated": false}, {"date": "2026-08-11", "open": 9.88, "close": 9.6, "high": 10.19, "low": 9.385, "volume": 1158000.0, "turnover": 11194050.0, "turnover_estimated": false}, {"date": "2026-08-12", "open": 9.6, "close": 9.63, "high": 10.18, "low": 9.58, "volume": 1570658.0, "turnover": 15385560.0, "turnover_estimated": false}, {"date": "2026-08-13", "open": 9.8, "close": 9.43, "high": 10.18, "low": 9.43, "volume": 1863000.0, "turnover": 18156860.0, "turnover_estimated": false}, {"date": "2026-08-14", "open": 9.465, "close": 9.33, "high": 9.725, "low": 9.25, "volume": 965000.0, "turnover": 9103180.0, "turnover_estimated": false}, {"date": "2026-08-17", "open": 9.38, "close": 9.485, "high": 9.62, "low": 9.3, "volume": 907097.0, "turnover": 8575530.0, "turnover_estimated": false}, {"date": "2026-08-18", "open": 9.32, "close": 8.95, "high": 9.32, "low": 8.77, "volume": 1673945.0, "turnover": 15004369.999999998, "turnover_estimated": false}, {"date": "2026-08-19", "open": 8.83, "close": 8.145, "high": 8.83, "low": 8.06, "volume": 2125697.0, "turnover": 17571650.0, "turnover_estimated": false}, {"date": "2026-08-20", "open": 8.28, "close": 8.49, "high": 8.65, "low": 8.24, "volume": 1315700.0, "turnover": 11096610.0, "turnover_estimated": false}, {"date": "2026-08-21", "open": 8.49, "close": 8.77, "high": 8.965, "low": 8.4, "volume": 1860500.0, "turnover": 16408240.0, "turnover_estimated": false}, {"date": "2026-08-24", "open": 8.77, "close": 8.38, "high": 8.77, "low": 8.36, "volume": 1080500.0, "turnover": 9112500.0, "turnover_estimated": false}, {"date": "2026-08-25", "open": 8.36, "close": 8.38, "high": 8.405, "low": 8.17, "volume": 833000.0, "turnover": 6909030.0, "turnover_estimated": false}, {"date": "2026-08-26", "open": 8.38, "close": 8.46, "high": 8.72, "low": 8.38, "volume": 513515.0, "turnover": 4395030.0, "turnover_estimated": false}, {"date": "2026-08-27", "open": 8.46, "close": 9.05, "high": 9.08, "low": 8.46, "volume": 2187642.0, "turnover": 19289540.0, "turnover_estimated": false}, {"date": "2026-08-28", "open": 9.2, "close": 8.68, "high": 9.345, "low": 8.64, "volume": 2143000.0, "turnover": 19210560.0, "turnover_estimated": false}, {"date": "2026-08-31", "open": 8.68, "close": 8.805, "high": 8.905, "low": 8.54, "volume": 781500.0, "turnover": 6835599.999999999, "turnover_estimated": false}, {"date": "2026-09-01", "open": 8.8, "close": 8.755, "high": 9.03, "low": 8.5, "volume": 813000.0, "turnover": 7141760.0, "turnover_estimated": false}, {"date": "2026-09-02", "open": 8.63, "close": 8.4, "high": 8.8, "low": 8.4, "volume": 1092608.0, "turnover": 9341130.0, "turnover_estimated": false}, {"date": "2026-09-03", "open": 8.7, "close": 9.54, "high": 9.58, "low": 8.535, "volume": 5632706.0, "turnover": 52150240.0, "turnover_estimated": false}, {"date": "2026-09-04", "open": 9.55, "close": 9.6, "high": 10.39, "low": 9.345, "volume": 7152070.0, "turnover": 70596060.0, "turnover_estimated": false}, {"date": "2026-09-07", "open": 11.04, "close": 12.47, "high": 12.63, "low": 10.38, "volume": 46729259.0, "turnover": 559498750.0, "turnover_estimated": false}, {"date": "2026-09-08", "open": 12.24, "close": 12.31, "high": 13.2, "low": 11.36, "volume": 26825209.0, "turnover": 327378730.0, "turnover_estimated": false}, {"date": "2026-09-09", "open": 12.53, "close": 11.2, "high": 12.73, "low": 11.02, "volume": 13147100.0, "turnover": 154078050.0, "turnover_estimated": false}, {"date": "2026-09-10", "open": 11.11, "close": 9.975, "high": 11.2, "low": 9.9, "volume": 13688822.0, "turnover": 141020230.0, "turnover_estimated": false}, {"date": "2026-09-11", "open": 9.81, "close": 9.095, "high": 9.83, "low": 8.8, "volume": 18103000.0, "turnover": 164613139.99999997, "turnover_estimated": false}, {"date": "2026-09-14", "open": 8.88, "close": 8.28, "high": 9.355, "low": 8.22, "volume": 11384503.0, "turnover": 98076330.0, "turnover_estimated": false}, {"date": "2026-09-15", "open": 8.41, "close": 7.9, "high": 8.775, "low": 7.855, "volume": 9737632.0, "turnover": 80906250.0, "turnover_estimated": false}, {"date": "2026-09-16", "open": 7.945, "close": 8.045, "high": 8.245, "low": 7.85, "volume": 8457500.0, "turnover": 68235970.0, "turnover_estimated": false}, {"date": "2026-09-17", "open": 8.045, "close": 8.65, "high": 9.3, "low": 7.985, "volume": 27200000.0, "turnover": 238071220.0, "turnover_estimated": false}, {"date": "2026-09-18", "open": 8.81, "close": 8.485, "high": 8.985, "low": 8.465, "volume": 12341000.0, "turnover": 107758670.0, "turnover_estimated": false}, {"date": "2026-09-21", "open": 8.645, "close": 8.49, "high": 8.645, "low": 8.27, "volume": 6419000.0, "turnover": 54109100.0, "turnover_estimated": false}, {"date": "2026-09-22", "open": 8.65, "close": 8.175, "high": 8.75, "low": 8.175, "volume": 7785329.0, "turnover": 65788220.0, "turnover_estimated": false}, {"date": "2026-09-23", "open": 8.285, "close": 7.795, "high": 8.29, "low": 7.735, "volume": 7768743.0, "turnover": 61425850.0, "turnover_estimated": false}, {"date": "2026-09-24", "open": 7.795, "close": 7.85, "high": 8.09, "low": 7.71, "volume": 3695156.0, "turnover": 29301450.0, "turnover_estimated": false}, {"date": "2026-09-25", "open": 7.85, "close": 7.995, "high": 8.005, "low": 7.64, "volume": 1378496.0, "turnover": 10761460.0, "turnover_estimated": false}, {"date": "2026-09-28", "open": 8.08, "close": 7.5, "high": 8.08, "low": 7.5, "volume": 4568460.0, "turnover": 34547600.0, "turnover_estimated": false}, {"date": "2026-09-29", "open": 7.535, "close": 7.105, "high": 7.73, "low": 7.08, "volume": 4969000.0, "turnover": 36154600.0, "turnover_estimated": false}, {"date": "2026-09-30", "open": 7.105, "close": 7.06, "high": 7.295, "low": 7.05, "volume": 4019439.0, "turnover": 28656130.0, "turnover_estimated": false}]

pipeline/prospectus_pipeline/data/allot/packets/HKIPO-MB3277.md

## 公告全文

<<<PAGE 11>>>
– 11 –
Allotees with Waivers/Consents Obtained
Investor
Number of 
Offer Shares 
allocated
% of Offer 
SharesNote 1
% of total H 
Shares after 
the Global 
OfferingNote 1
% of total 
issued share 
capital after 
the Global 
OfferingNote 1
Relationship
Allotees with waiver from strict compliance with Rule 10.04 of the Listing Rules and consent under paragraph 1C(2) 
of the Placing Guidelines and Chapter 4.15 of the Guide for New Listing Applicants in relation to subscription for H 
Shares by existing Shareholders and/or their close associates Note 2
HTI FINANCIAL 
SOLUTIONS 
LIMITED (“HTIF”)
98,100
0.15%
0.03%
0.02%
To subscribe for and hold the Offer 
Shares under the International 
Offering on behalf of Zhongke 
Chuangxing Technology Investment 
Co., Ltd. (中科創星科技投資有
限公司), a close associate of an 
existing Shareholder, i.e. Zhongke 
Chuangxing.
HTCI
1,374,700
2.11%
0.47%
0.32%
To subscribe for and hold the Offer 
Shares under the International 
Offering on behalf of Ji’ao Qianheng 
No.3 Private Equity Investment Fund 
(吉翱謙亨三號私募證券投資基
金), whose fund manager is a close 
associate of an existing Shareholder, 
i.e. Jilin Yuanheng.

<<<PAGE 20>>>
– 20 –
Name
Number of 
H Shares 
held in the 
Company 
subject to 
lock-up 
undertakings
upon Listing
% of
total issued
H Shares in
the Company
subject to
lock-up
undertakings
upon Listing 
Note 1
% of 
shareholding 
in the 
Company 
subject to 
lock-up upon 
Listing Note 1
Last day subject 
to the lock-up 
undertakings Note 2
Voyage42 Master Fund
667,700
0.23%
0.15%
October 16, 2026
WT Asset Management
981,900
0.34%
0.23%
October 16, 2026
E Fund HK
490,900
0.17%
0.11%
October 16, 2026
E Fund Management
98,100
0.03%
0.02%
October 16, 2026
China AMC
392,700
0.13%
0.09%
October 16, 2026
Cithara Fund
392,700
0.13%
0.09%
October 16, 2026
Panjing Fund
392,700
0.13%
0.09%
October 16, 2026
Value Partners Hong Kong Limited
343,600
0.12%
0.08%
October 16, 2026
Value Partners Limited
49,000
0.02%
0.01%
October 16, 2026
China Orient Multi-Strategy Master 
Fund
340,000
0.12%
0.08%
October 16, 2026
CMSIM
196,300
0.07%
0.05%
October 16, 2026
Total
32,645,200
11.21%
7.50%
Notes:
1.	
Assuming the Over-allotment Option is not exercised.
2.	
In accordance with each of the respective Cornerstone Investment Agreements, the required lock-up 
period of six months from the Listing Date ends on October 16, 2026. The Cornerstone Investors 
will cease to be prohibited from disposing of or transferring H Shares after the indicated date. For 
further details, please see “Cornerstone Investors — Restrictions on the Cornerstone Investors” in 
the Prospectus.

<<<PAGE 24>>>
– 24 –
PLACEE CONCENTRATION ANALYSIS
Placees
Number of 
H Shares 
allotted
Allotment 
as % of 
International 
Offering 
(assuming 
no exercise 
of the Over-
allotment 
Option)
Allotment 
as % of 
International 
Offering 
(assuming 
the Over-
allotment 
Option is 
exercised 
and new H 
Shares are 
issued)
Allotment as 
% of total 
Offer Shares 
(assuming 
no exercise 
of the Over-
allotment 
Option)
Allotment as 
% of total 
Offer Shares 
(assuming 
the Over-
allotment 
Option is 
exercised 
and new H 
Shares are 
issued)
Number of 
Shares held 
upon Listing
% of total 
issued share 
capital upon 
Listing 
(assuming 
no exercise 
of the Over-
allotment 
Option)
% of total 
issued share 
capital upon 
Listing 
(assuming 
the Over-
allotment 
Option is 
exercised 
and new H 
Shares are 
issued)
Top 1
5,891,800
10.03%
8.59%
9.02%
7.85%
5,891,800
1.35%
1.32%
Top 5
22,339,300
38.01%
32.58%
34.21%
29.75%
22,339,300
5.13%
5.02%
Top 10
36,086,300
61.41%
52.64%
55.27%
48.06%
36,086,300
8.29%
8.11%
Top 25
55,186,500
93.91%
80.50%
84.52%
73.50%
55,186,500
12.68%
12.40%
Notes
*  Ranking of placees is based on the number of H Shares allotted to the placees.
H SHAREHOLDERS CONCENTRATION ANALYSIS
H Shareholders
*
Number of 
H Shares 
allotted
Allotment 
as % of 
International 
Offering 
(assuming no 
exercise of the 
Over-allotment 
Option)
Allotment 
as % of 
International 
Offering 
(assuming the 
Over-allotment 
Option is 
exercised and 
new H Shares 
are issued)
Allotment as 
% of total 
Offer Shares 
(assuming no 
exercise of the 
Over-allotment 
Option)
Allotment as 
% of total 
Offer Shares 
(assuming 
the Over-
allotment 
Option is 
exercised and 
new H Shares 
are issued)
Number of H 
Shares held 
upon Listing
% of total 
issued H 
Shares capital 
upon Listing 
(assuming no 
exercise of the 
Over-allotment 
Option)
% of total 
issued H 
Shares capital 
upon Listing 
(assuming 
the Over-
allotment 
Option is 
exercised and 
new H Shares 
are issued)
Number of 
Shares held 
upon Listing
Top 1
0
0.00%
0.00%
0.00%
0.00%
119,123,550
40.92%
39.58%
183,267,000
Top 5
5,891,800
10.03%
8.59%
9.02%
7.85%
217,399,850
74.67%
72.24%
331,288,800
Top 10
22,339,300
38.01%
32.58%
34.21%
29.75%
236,733,350
81.31%
78.67%
352,176,300
Top 25
45,022,400
76.61%
65.67%
68.95%
59.96%
266,038,200
91.38%
88.40%
383,054,400
Notes
*  Ranking of H Shareholders is based on the number of H Shares held by the H Shareholders upon Listing.

<<<PAGE 29>>>
– 29 –
COMPLIANCE WITH LISTING RULES AND GUIDANCE
The Directors confirm that, except for the Listing Rules that have been waived and/or in 
respect of which consent has been obtained, the Company has complied with the Listing 
Rules and guidance materials in relation to the placing, allotment and listing of the H Shares.
The Directors confirm that, to the best of their knowledge, no rebate has been, directly or 
indirectly, provided by the Company, its controlling shareholder(s), directors or syndicate 
members to any placees or the public (as the case may be) and the consideration payable 
by them directly or indirectly for each Offer Share subscribed for or purchased by them 
is the same as the Offer Price in addition to any brokerage, AFRC transaction levy, SFC 
transaction levy and trading fee payable.
OTHERS/ADDITIONAL INFORMATION
Placing to close associates of existing Shareholders with a waiver from the strict 
compliance with Rule 10.04 of the Listing Rules and a prior consent under paragraph 
1C(2) of the Placing Guidelines
The Company has applied to the Stock Exchange, and the Stock Exchange has granted, the 
waivers from the strict compliance with Rule 10.04 of the Listing Rules and consents under 
paragraph 1C(2) of the Placing Guidelines to permit the Company to allocate such Offer 
Shares in the International Offering to close associates (the “Placees”) of Existing Minority 
Shareholders (as defined below) on the following grounds which are consistent with the 
conditions as set out in the Chapter 4.15 of the Guide for New Listing Applicant:
(a)	
The Joint Sponsors confirm that:
(i)	
each of Beijing Phase II Zhongke Chuangxing Hard Technology Venture Capital 
Partnership (Limited Partnership) (北京二期中科創星硬科技創業投資合夥
企業(有限合夥)), and Jilin Yuanheng Equity Investment Partnership (Limited 
Partnership) (吉林省元亨股權投資合夥企業(有限合夥)) (the “Existing 
Minority Shareholders”) is interested in less than 5% of the Company’s voting 
rights before the Listing;
(ii)	 none of the Existing Minority Shareholders or their close associates is a core 
connected person of the Company or its close associate;
(iii)	 none of the Existing Minority Shareholders or their close associates has the 
power to appoint any Directors to the Board or any other special rights upon the 
Listing;