pipeline/prospectus_pipeline/data/market/ah_reference/h_bars/hk02715.json

[
 {
  "date": "2026-03-09",
  "open": 15.36,
  "close": 12.9,
  "high": 15.36,
  "low": 12.5,
  "volume": 20582460.0
 },
 {
  "date": "2026-03-10",
  "open": 12.51,
  "close": 13.33,
  "high": 13.75,
  "low": 12.51,
  "volume": 4139800.0
 },
 {
  "date": "2026-03-11",
  "open": 13.55,
  "close": 14.06,
  "high": 14.77,
  "low": 13.55,
  "volume": 3386060.0
 },
 {
  "date": "2026-03-12",
  "open": 14.06,
  "close": 13.61,
  "high": 14.28,
  "low": 13.59,
  "volume": 1195200.0
 },
 {
  "date": "2026-03-13",
  "open": 13.62,
  "close": 12.9,
  "high": 13.62,
  "low": 12.8,
  "volume": 1766800.0
 },
 {
  "date": "2026-03-16",
  "open": 12.91,
  "close": 12.84,
  "high": 13.38,
  "low": 12.36,
  "volume": 2013800.0
 },
 {
  "date": "2026-03-17",
  "open": 12.84,
  "close": 12.68,
  "high": 13.27,
  "low": 12.68,
  "volume": 569800.0
 },
 {
  "date": "2026-03-18",
  "open": 12.68,
  "close": 12.57,
  "high": 12.83,
  "low": 12.47,
  "volume": 1102200.0
 },
 {
  "date": "2026-03-19",
  "open": 12.56,
  "close": 12.31,
  "high": 12.56,
  "low": 12.3,
  "volume": 493600.0
 },
 {
  "date": "2026-03-20",
  "open": 12.31,
  "close": 12.39,
  "high": 12.5,
  "low": 12.22,
  "volume": 287000.0
 },
 {
  "date": "2026-03-23",
  "open": 12.2,
  "close": 13.0,
  "high": 13.27,
  "low": 11.68,
  "volume": 2618800.0
 },
 {
  "date": "2026-03-24",
  "open": 13.0,
  "close": 12.15,
  "high": 13.0,
  "low": 12.15,
  "volume": 608600.0
 },
 {
  "date": "2026-03-25",
  "open": 12.0,
  "close": 11.73,
  "high": 12.49,
  "low": 11.73,
  "volume": 880200.0
 },
 {
  "date": "2026-03-26",
  "open": 11.73,
  "close": 11.45,
  "high": 12.0,
  "low": 11.38,
  "volume": 865600.0
 },
 {
  "date": "2026-03-27",
  "open": 11.45,
  "close": 12.03,
  "high": 12.29,
  "low": 11.35,
  "volume": 992400.0
 },
 {
  "date": "2026-03-30",
  "open": 12.01,
  "close": 12.09,
  "high": 12.39,
  "low": 11.58,
  "volume": 592000.0
 },
 {
  "date": "2026-03-31",
  "open": 12.06,
  "close": 11.25,
  "high": 12.33,
  "low": 11.22,
  "volume": 698400.0
 },
 {
  "date": "2026-04-01",
  "open": 11.6,
  "close": 11.43,
  "high": 11.8,
  "low": 11.3,
  "volume": 598600.0
 },
 {
  "date": "2026-04-02",
  "open": 11.43,
  "close": 11.86,
  "high": 11.99,
  "low": 11.4,
  "volume": 760200.0
 },
 {
  "date": "2026-04-08",
  "open": 12.24,
  "close": 12.87,
  "high": 13.27,
  "low": 12.24,
  "volume": 4394400.0
 },
 {
  "date": "2026-04-09",
  "open": 13.05,
  "close": 12.57,
  "high": 13.13,
  "low": 12.41,
  "volume": 2058200.0
 },
 {
  "date": "2026-04-10",
  "open": 12.64,
  "close": 12.79,
  "high": 13.05,
  "low": 12.41,
  "volume": 1699800.0
 },
 {
  "date": "2026-04-13",
  "open": 12.79,
  "close": 13.6,
  "high": 13.86,
  "low": 12.75,
  "volume": 3562400.0
 },
 {
  "date": "2026-04-14",
  "open": 13.7,
  "close": 13.28,
  "high": 13.9,
  "low": 13.03,
  "volume": 1788800.0
 },
 {
  "date": "2026-04-15",
  "open": 13.28,
  "close": 12.94,
  "high": 13.98,
  "low": 12.7,
  "volume": 1974000.0
 },
 {
  "date": "2026-04-16",
  "open": 12.94,
  "close": 13.1,
  "high": 13.33,
  "low": 12.94,
  "volume": 1259800.0
 },
 {
  "date": "2026-04-17",
  "open": 13.13,
  "close": 13.37,
  "high": 13.86,
  "low": 13.1,
  "volume": 1644200.0
 },
 {
  "date": "2026-04-20",
  "open": 13.37,
  "close": 13.02,
  "high": 13.81,
  "low": 12.86,
  "volume": 2397600.0
 },
 {
  "date": "2026-04-21",
  "open": 12.9,
  "close": 12.63,
  "high": 13.11,
  "low": 12.51,
  "volume": 1039600.0
 },
 {
  "date": "2026-04-22",
  "open": 12.52,
  "close": 12.6,
  "high": 12.79,
  "low": 12.48,
  "volume": 925400.0
 },
 {
  "date": "2026-04-23",
  "open": 12.44,
  "close": 12.36,
  "high": 12.71,
  "low": 12.32,
  "volume": 448000.0
 },
 {
  "date": "2026-04-24",
  "open": 12.36,
  "close": 12.19,
  "high": 12.5,
  "low": 12.18,
  "volume": 617800.0
 },
 {
  "date": "2026-04-27",
  "open": 12.22,
  "close": 12.58,
  "high": 12.75,
  "low": 12.22,
  "volume": 1239750.0
 },
 {
  "date": "2026-04-28",
  "open": 12.59,
  "close": 11.96,
  "high": 12.59,
  "low": 11.95,
  "volume": 813600.0
 },
 {
  "date": "2026-04-29",
  "open": 12.09,
  "close": 12.39,
  "high": 12.39,
  "low": 12.03,
  "volume": 515200.0
 },
 {
  "date": "2026-04-30",
  "open": 12.5,
  "close": 12.83,
  "high": 13.71,
  "low": 12.5,
  "volume": 7333582.0
 },
 {
  "date": "2026-05-04",
  "open": 12.9,
  "close": 13.67,
  "high": 14.0,
  "low": 12.9,
  "volume": 922400.0
 },
 {
  "date": "2026-05-05",
  "open": 13.67,
  "close": 13.29,
  "high": 13.67,
  "low": 13.16,
  "volume": 254000.0
 },
 {
  "date": "2026-05-06",
  "open": 13.3,
  "close": 13.8,
  "high": 14.26,
  "low": 12.96,
  "volume": 4338000.0
 },
 {
  "date": "2026-05-07",
  "open": 13.82,
  "close": 14.64,
  "high": 15.0,
  "low": 13.79,
  "volume": 3940600.0
 },
 {
  "date": "2026-05-08",
  "open": 14.64,
  "close": 14.7,
  "high": 15.33,
  "low": 14.6,
  "volume": 3689850.0
 },
 {
  "date": "2026-05-11",
  "open": 14.7,
  "close": 15.01,
  "high": 15.2,
  "low": 14.38,
  "volume": 2224600.0
 },
 {
  "date": "2026-05-12",
  "open": 15.02,
  "close": 14.88,
  "high": 15.76,
  "low": 14.79,
  "volume": 2676100.0
 },
 {
  "date": "2026-05-13",
  "open": 15.0,
  "close": 14.6,
  "high": 15.0,
  "low": 14.21,
  "volume": 2228600.0
 },
 {
  "date": "2026-05-14",
  "open": 14.89,
  "close": 14.27,
  "high": 15.02,
  "low": 14.23,
  "volume": 1669400.0
 },
 {
  "date": "2026-05-15",
  "open": 14.56,
  "close": 15.24,
  "high": 16.94,
  "low": 14.23,
  "volume": 23919600.0
 },
 {
  "date": "2026-05-18",
  "open": 15.36,
  "close": 15.3,
  "high": 15.68,
  "low": 14.69,
  "volume": 10963200.0
 },
 {
  "date": "2026-05-19",
  "open": 15.3,
  "close": 15.51,
  "high": 15.66,
  "low": 15.0,
  "volume": 3945400.0
 },
 {
  "date": "2026-05-20",
  "open": 15.51,
  "close": 14.38,
  "high": 15.51,
  "low": 14.15,
  "volume": 5740200.0
 },
 {
  "date": "2026-05-21",
  "open": 14.5,
  "close": 15.9,
  "high": 16.9,
  "low": 14.45,
  "volume": 24118600.0
 },
 {
  "date": "2026-05-22",
  "open": 16.0,
  "close": 16.59,
  "high": 17.12,
  "low": 15.58,
  "volume": 12381096.0
 },
 {
  "date": "2026-05-26",
  "open": 16.7,
  "close": 19.93,
  "high": 20.76,
  "low": 16.11,
  "volume": 26516300.0
 },
 {
  "date": "2026-05-27",
  "open": 20.6,
  "close": 18.64,
  "high": 20.6,
  "low": 18.06,
  "volume": 12976553.0
 },
 {
  "date": "2026-05-28",
  "open": 18.64,
  "close": 18.14,
  "high": 19.24,
  "low": 17.58,
  "volume": 9269600.0
 },
 {
  "date": "2026-05-29",
  "open": 18.59,
  "close": 16.84,
  "high": 19.55,
  "low": 16.69,
  "volume": 14650400.0
 },
 {
  "date": "2026-06-01",
  "open": 16.84,
  "close": 16.33,
  "high": 17.13,
  "low": 16.11,
  "volume": 5362400.0
 },
 {
  "date": "2026-06-02",
  "open": 16.4,
  "close": 16.62,
  "high": 17.89,
  "low": 16.36,
  "volume": 10947200.0
 },
 {
  "date": "2026-06-03",
  "open": 16.73,
  "close": 17.16,
  "high": 18.35,
  "low": 16.22,
  "volume": 22556600.0
 },
 {
  "date": "2026-06-04",
  "open": 17.06,
  "close": 16.53,
  "high": 18.2,
  "low": 16.53,
  "volume": 13021600.0
 },
 {
  "date": "2026-06-05",
  "open": 16.72,
  "close": 18.16,
  "high": 18.25,
  "low": 15.41,
  "volume": 23756000.0
 },
 {
  "date": "2026-06-08",
  "open": 17.85,
  "close": 20.4,
  "high": 21.28,
  "low": 17.3,
  "volume": 42406068.0
 },
 {
  "date": "2026-06-09",
  "open": 21.5,
  "close": 21.06,
  "high": 22.54,
  "low": 20.3,
  "volume": 32758200.0
 },
 {
  "date": "2026-06-10",
  "open": 21.32,
  "close": 17.65,
  "high": 21.6,
  "low": 17.45,
  "volume": 31285285.0
 },
 {
  "date": "2026-06-11",
  "open": 17.0,
  "close": 16.63,
  "high": 17.63,
  "low": 15.93,
  "volume": 16638400.0
 },
 {
  "date": "2026-06-12",
  "open": 17.0,
  "close": 17.0,
  "high": 18.4,
  "low": 16.76,
  "volume": 17659600.0
 },
 {
  "date": "2026-06-15",
  "open": 17.61,
  "close": 18.15,
  "high": 18.36,
  "low": 17.04,
  "volume": 12421000.0
 },
 {
  "date": "2026-06-16",
  "open": 18.3,
  "close": 18.43,
  "high": 19.84,
  "low": 17.63,
  "volume": 14555000.0
 },
 {
  "date": "2026-06-17",
  "open": 18.89,
  "close": 18.62,
  "high": 19.12,
  "low": 17.8,
  "volume": 9160400.0
 },
 {
  "date": "2026-06-18",
  "open": 18.8,
  "close": 21.0,
  "high": 21.36,
  "low": 18.78,
  "volume": 25952300.0
 },
 {
  "date": "2026-06-22",
  "open": 21.78,
  "close": 19.79,
  "high": 21.78,
  "low": 19.2,
  "volume": 17525000.0
 },
 {
  "date": "2026-06-23",
  "open": 20.0,
  "close": 19.68,
  "high": 20.82,
  "low": 18.52,
  "volume": 16223800.0
 },
 {
  "date": "2026-06-24",
  "open": 19.47,
  "close": 19.05,
  "high": 20.06,
  "low": 18.7,
  "volume": 9734400.0
 },
 {
  "date": "2026-06-25",
  "open": 19.48,
  "close": 18.2,
  "high": 20.46,
  "low": 18.17,
  "volume": 16136375.0
 },
 {
  "date": "2026-06-26",
  "open": 18.33,
  "close": 17.48,
  "high": 18.44,
  "low": 17.0,
  "volume": 9995000.0
 },
 {
  "date": "2026-06-29",
  "open": 17.48,
  "close": 17.0,
  "high": 18.23,
  "low": 16.8,
  "volume": 8051400.0
 },
 {
  "date": "2026-06-30",
  "open": 17.31,
  "close": 18.68,
  "high": 19.11,
  "low": 17.14,
  "volume": 17063800.0
 },
 {
  "date": "2026-07-02",
  "open": 20.8,
  "close": 19.16,
  "high": 21.2,
  "low": 18.73,
  "volume": 25178401.0
 },
 {
  "date": "2026-07-03",
  "open": 19.8,
  "close": 25.5,
  "high": 25.6,
  "low": 19.72,
  "volume": 62042000.0
 },
 {
  "date": "2026-07-06",
  "open": 24.5,
  "close": 23.32,
  "high": 26.18,
  "low": 22.44,
  "volume": 38967400.0
 },
 {
  "date": "2026-07-07",
  "open": 22.78,
  "close": 23.6,
  "high": 24.92,
  "low": 21.88,
  "volume": 41003000.0
 },
 {
  "date": "2026-07-08",
  "open": 22.96,
  "close": 19.27,
  "high": 22.96,
  "low": 19.2,
  "volume": 22801000.0
 },
 {
  "date": "2026-07-09",
  "open": 19.55,
  "close": 20.6,
  "high": 21.28,
  "low": 18.52,
  "volume": 32154810.0
 },
 {
  "date": "2026-07-10",
  "open": 21.36,
  "close": 21.44,
  "high": 22.98,
  "low": 20.62,
  "volume": 31557800.0
 },
 {
  "date": "2026-07-13",
  "open": 21.16,
  "close": 19.6,
  "high": 21.3,
  "low": 18.88,
  "volume": 13203000.0
 },
 {
  "date": "2026-07-14",
  "open": 19.95,
  "close": 20.5,
  "high": 21.1,
  "low": 19.5,
  "volume": 15520556.0
 },
 {
  "date": "2026-07-15",
  "open": 21.38,
  "close": 21.1,
  "high": 22.56,
  "low": 21.1,
  "volume": 19527800.0
 },
 {
  "date": "2026-07-16",
  "open": 21.12,
  "close": 22.7,
  "high": 23.4,
  "low": 20.38,
  "volume": 26482200.0
 },
 {
  "date": "2026-07-17",
  "open": 23.1,
  "close": 19.47,
  "high": 23.1,
  "low": 19.31,
  "volume": 17506673.0
 },
 {
  "date": "2026-07-20",
  "open": 19.89,
  "close": 18.39,
  "high": 20.3,
  "low": 17.92,
  "volume": 14425800.0
 },
 {
  "date": "2026-07-21",
  "open": 18.98,
  "close": 18.73,
  "high": 19.63,
  "low": 16.73,
  "volume": 18837874.0
 },
 {
  "date": "2026-07-22",
  "open": 18.91,
  "close": 19.26,
  "high": 19.98,
  "low": 18.73,
  "volume": 13648400.0
 },
 {
  "date": "2026-07-23",
  "open": 18.49,
  "close": 18.38,
  "high": 19.84,
  "low": 18.34,
  "volume": 9420385.0
 },
 {
  "date": "2026-07-24",
  "open": 17.69,
  "close": 17.58,
  "high": 18.69,
  "low": 17.56,
  "volume": 5852000.0
 },
 {
  "date": "2026-07-27",
  "open": 17.62,
  "close": 18.33,
  "high": 18.58,
  "low": 16.97,
  "volume": 7712200.0
 },
 {
  "date": "2026-07-28",
  "open": 17.87,
  "close": 18.17,
  "high": 18.76,
  "low": 17.68,
  "volume": 6179400.0
 },
 {
  "date": "2026-07-29",
  "open": 18.63,
  "close": 18.19,
  "high": 19.88,
  "low": 18.19,
  "volume": 12351200.0
 },
 {
  "date": "2026-07-30",
  "open": 18.24,
  "close": 15.97,
  "high": 18.24,
  "low": 15.88,
  "volume": 11259100.0
 },
 {
  "date": "2026-07-31",
  "open": 17.0,
  "close": 16.8,
  "high": 17.65,
  "low": 16.6,
  "volume": 17074800.0
 },
 {
  "date": "2026-08-03",
  "open": 16.84,
  "close": 17.57,
  "high": 18.18,
  "low": 16.84,
  "volume": 13699800.0
 },
 {
  "date": "2026-08-04",
  "open": 17.73,
  "close": 18.07,
  "high": 18.36,
  "low": 17.25,
  "volume": 9751800.0
 },
 {
  "date": "2026-08-05",
  "open": 18.3,
  "close": 18.84,
  "high": 19.2,
  "low": 18.1,
  "volume": 14827200.0
 },
 {
  "date": "2026-08-06",
  "open": 19.16,
  "close": 18.5,
  "high": 19.32,
  "low": 18.2,
  "volume": 10455600.0
 },
 {
  "date": "2026-08-07",
  "open": 18.75,
  "close": 18.92,
  "high": 19.0,
  "low": 18.12,
  "volume": 9247970.0
 },
 {
  "date": "2026-08-10",
  "open": 19.15,
  "close": 18.37,
  "high": 19.52,
  "low": 18.05,
  "volume": 5954000.0
 },
 {
  "date": "2026-08-11",
  "open": 18.34,
  "close": 19.6,
  "high": 19.79,
  "low": 18.0,
  "volume": 15587200.0
 },
 {
  "date": "2026-08-12",
  "open": 19.8,
  "close": 19.0,
  "high": 19.8,
  "low": 18.92,
  "volume": 7664923.0
 },
 {
  "date": "2026-08-13",
  "open": 19.2,
  "close": 18.41,
  "high": 19.65,
  "low": 18.41,
  "volume": 8084400.0
 },
 {
  "date": "2026-08-14",
  "open": 18.75,
  "close": 18.22,
  "high": 18.75,
  "low": 17.91,
  "volume": 4548600.0
 },
 {
  "date": "2026-08-17",
  "open": 18.47,
  "close": 19.09,
  "high": 19.14,
  "low": 18.22,
  "volume": 6461200.0
 },
 {
  "date": "2026-08-18",
  "open": 19.3,
  "close": 20.7,
  "high": 21.06,
  "low": 18.72,
  "volume": 24649200.0
 },
 {
  "date": "2026-08-19",
  "open": 20.44,
  "close": 17.76,
  "high": 20.44,
  "low": 17.76,
  "volume": 13003001.0
 },
 {
  "date": "2026-08-20",
  "open": 18.01,
  "close": 17.34,
  "high": 18.07,
  "low": 16.88,
  "volume": 8593200.0
 },
 {
  "date": "2026-08-21",
  "open": 17.4,
  "close": 17.84,
  "high": 18.12,
  "low": 17.33,
  "volume": 6286928.0
 },
 {
  "date": "2026-08-24",
  "open": 18.18,
  "close": 16.8,
  "high": 18.18,
  "low": 16.8,
  "volume": 4794800.0
 },
 {
  "date": "2026-08-25",
  "open": 16.8,
  "close": 17.22,
  "high": 17.5,
  "low": 16.8,
  "volume": 4157000.0
 },
 {
  "date": "2026-08-26",
  "open": 17.32,
  "close": 17.09,
  "high": 17.38,
  "low": 17.02,
  "volume": 3108000.0
 },
 {
  "date": "2026-08-27",
  "open": 17.27,
  "close": 17.4,
  "high": 17.48,
  "low": 17.03,
  "volume": 3801200.0
 },
 {
  "date": "2026-08-28",
  "open": 17.43,
  "close": 17.05,
  "high": 17.7,
  "low": 17.04,
  "volume": 3343600.0
 },
 {
  "date": "2026-08-31",
  "open": 16.99,
  "close": 17.15,
  "high": 17.2,
  "low": 16.65,
  "volume": 2507240.0
 },
 {
  "date": "2026-09-01",
  "open": 17.21,
  "close": 16.8,
  "high": 17.4,
  "low": 16.8,
  "volume": 3050600.0
 },
 {
  "date": "2026-09-02",
  "open": 16.64,
  "close": 16.34,
  "high": 16.78,
  "low": 16.2,
  "volume": 2036837.0
 },
 {
  "date": "2026-09-03",
  "open": 16.4,
  "close": 16.45,
  "high": 16.92,
  "low": 16.4,
  "volume": 2149400.0
 },
 {
  "date": "2026-09-04",
  "open": 16.69,
  "close": 16.08,
  "high": 17.04,
  "low": 15.99,
  "volume": 3736000.0
 },
 {
  "date": "2026-09-07",
  "open": 16.15,
  "close": 16.22,
  "high": 16.73,
  "low": 16.15,
  "volume": 3313000.0
 },
 {
  "date": "2026-09-08",
  "open": 16.35,
  "close": 15.91,
  "high": 16.68,
  "low": 15.88,
  "volume": 2861400.0
 },
 {
  "date": "2026-09-09",
  "open": 16.03,
  "close": 15.24,
  "high": 16.03,
  "low": 15.15,
  "volume": 4636663.0
 },
 {
  "date": "2026-09-10",
  "open": 15.24,
  "close": 14.75,
  "high": 15.24,
  "low": 14.7,
  "volume": 2828000.0
 },
 {
  "date": "2026-09-11",
  "open": 14.88,
  "close": 14.46,
  "high": 14.88,
  "low": 14.18,
  "volume": 2898800.0
 },
 {
  "date": "2026-09-14",
  "open": 14.46,
  "close": 14.42,
  "high": 14.7,
  "low": 14.24,
  "volume": 2949000.0
 },
 {
  "date": "2026-09-15",
  "open": 14.47,
  "close": 14.34,
  "high": 14.62,
  "low": 14.26,
  "volume": 1370800.0
 },
 {
  "date": "2026-09-16",
  "open": 14.35,
  "close": 14.61,
  "high": 14.7,
  "low": 14.21,
  "volume": 1854000.0
 },
 {
  "date": "2026-09-17",
  "open": 14.61,
  "close": 14.76,
  "high": 14.99,
  "low": 14.5,
  "volume": 3579200.0
 },
 {
  "date": "2026-09-18",
  "open": 15.1,
  "close": 15.03,
  "high": 15.25,
  "low": 14.69,
  "volume": 3298200.0
 },
 {
  "date": "2026-09-21",
  "open": 15.3,
  "close": 14.99,
  "high": 15.32,
  "low": 14.9,
  "volume": 2449000.0
 },
 {
  "date": "2026-09-22",
  "open": 15.19,
  "close": 14.78,
  "high": 15.26,
  "low": 14.76,
  "volume": 1588800.0
 },
 {
  "date": "2026-09-23",
  "open": 14.78,
  "close": 14.57,
  "high": 14.92,
  "low": 14.4,
  "volume": 2029400.0
 },
 {
  "date": "2026-09-24",
  "open": 14.71,
  "close": 14.59,
  "high": 15.36,
  "low": 14.56,
  "volume": 4810300.0
 },
 {
  "date": "2026-09-25",
  "open": 14.61,
  "close": 14.84,
  "high": 14.84,
  "low": 14.4,
  "volume": 91600.0
 },
 {
  "date": "2026-09-28",
  "open": 14.96,
  "close": 14.12,
  "high": 15.24,
  "low": 14.12,
  "volume": 1809979.0
 },
 {
  "date": "2026-09-29",
  "open": 14.13,
  "close": 13.91,
  "high": 14.37,
  "low": 13.81,
  "volume": 1527000.0
 },
 {
  "date": "2026-09-30",
  "open": 13.95,
  "close": 14.08,
  "high": 14.46,
  "low": 13.92,
  "volume": 1970800.0
 }
]

pipeline/prospectus_pipeline/data/allot/packets/allot/packets/HKIPO-MB0625.md

## 公告全文

<<<PAGE 19>>>
19
PLACEE CONCENTRATION ANALYSIS
Placees*
Number 
of Class 
B Shares 
allotted
Allotment 
as % of the 
International 
Offering 
(assuming 
no exercise 
of the Over-
allotment 
Option)
Allotment 
as % of the 
International 
Offering 
(assuming the 
Over-allotment 
Option is fully 
exercised 
and new 
Class B 
Shares are 
issued)
Allotment as 
% of total 
Offer Shares 
(assuming 
no exercise 
of the Over-
allotment 
Option)
Allotment as 
% of total 
Offer Shares 
(assuming 
the Over-
allotment 
Option 
is fully 
exercised and 
new Class B 
Shares are 
issued)
Number 
of Class B 
Shares held 
upon Listing
Number 
of Shares 
held upon 
Listing**
% of total 
issued Class 
B Shares 
upon Listing 
(assuming 
no exercise 
of the Over-
allotment 
Option)
% of total 
issued Class 
B Shares upon 
Listing 
(assuming the 
Over-allotment 
Option is fully 
exercised and 
new Class B 
Shares are 
issued)
% of total 
issued Shares 
upon Listing 
(assuming 
no exercise 
of the Over-
allotment 
Option)**
% of total 
issued Shares 
upon Listing 
(assuming the 
Over-allotment 
Option is fully 
exercised and 
new Class B 
Shares are 
issued)**
Top 1
34,152,100
13.6%
11.6%
12.2%
10.6%
48,477,993
48,477,993
1.7%
1.7%
1.1%
1.1%
Top 5
128,714,500
51.1%
43.8%
46.0%
40.0%
389,231,171
389,231,171
13.8%
13.6%
9.2%
9.1%
Top 10
176,720,500
70.1%
60.1%
63.1%
54.9%
605,931,914
605,931,914
21.4%
21.1%
14.3%
14.1%
Top 25
250,416,100
99.4%
85.2%
89.4%
77.8%
903,329,218
903,329,218
31.9%
31.4%
21.3%
21.1%
* 
Ranking of placees is based on the number of Offer Shares allotted to the placees.
** 
Total issued shares upon Listing include Class A Shares (i.e. Shares with weighted voting rights which will 
not be converted into Class B Shares upon Listing). For details on the weighted voting rights structure of the 
Company, please refer to the section headed “Share Capital” of the Prospectus.
Shareholders of Class B Shares Concentration Analysis
Class B 
Shareholders*
Number of 
Class B 
Shares allotted
Allotment 
as % of the 
International 
Offering 
(assuming no 
exercise of the 
Over-allotment 
Option)
Allotment 
as % of the 
International 
Offering 
(assuming the 
Over-allotment 
Option is fully 
exercised and 
new Class B 
Shares are 
issued)
Allotment as 
% of total 
Offer Shares 
(assuming no 
exercise of the 
Over-allotment 
Option)
Allotment as 
% of total 
Offer Shares 
(assuming the 
Over-allotment 
Option is fully 
exercised and 
new Class B 
Shares are 
issued)
Number of 
Class B Shares 
held upon 
Listing
Number of 
Shares held 
upon Listing**
% of total 
issued Class 
B Shares 
upon Listing 
(assuming no 
exercise of the 
Over-allotment 
Option)
% of total 
issued Class 
B Shares 
upon Listing 
(assuming the 
Over-allotment 
Option is fully 
exercised and 
new Class B 
Shares are 
issued)
% of total 
issued Shares 
upon Listing 
(assuming no 
exercise of the 
Over-allotment 
Option)**
% of total 
issued Shares 
upon Listing 
(assuming the 
Over-allotment 
Option is fully 
exercised and 
new Class B 
Shares are 
issued)**
Top 1
–
–
–
–
–
487,090,102
1,286,063,250
17.2%
17.0%
30.3%
30.0%
Top 5
27,425,400
10.9%
9.3%
9.8%
8.5%
1,681,794,225
2,686,347,279
59.4%
58.5%
63.3%
62.6%
Top 10
74,804,500
29.7%
25.4%
26.7%
23.2%
2,232,889,771
3,648,602,637
78.9%
77.7%
85.9%
85.1%
Top 25
187,128,500
74.3%
63.7%
66.8%
58.1%
2,657,948,647
4,073,661,513
93.9%
92.5%
95.9%
95.0%
* 
Ranking of Shareholders of Class B Shares is based on the number of Class B Shares held by the Shareholders 
of Class B Shares upon Listing.
** 
Total issued shares upon Listing include Class A Shares (i.e. Shares with weighted voting rights which will 
not be converted into Class B Shares upon Listing). For details on the weighted voting rights structure of the 
Company, please refer to the section headed “Share Capital” of the Prospectus.

<<<PAGE 21>>>
21
BASIS OF ALLOCATION UNDER THE HONG KONG PUBLIC OFFERING
Subject to the satisfaction of the conditions set out in the Prospectus, a total of 35,751 valid 
applications made by the public will be conditionally allocated on the basis set out below:
NO. OF 
SHARES
APPLIED 
FOR
NO. OF VALID
APPLICATIONS
BASIS OF ALLOTMENT/BALLOT
APPROXIMATE 
PERCENTAGE 
ALLOTTED OF 
THE TOTAL 
NO. OF SHARES 
APPLIED FOR
POOL A
100
15,312
2,820 out of 15,312 to receive 100 Shares
18.42%
200
5,341
1,967 out of 5,341 to receive 100 Shares
18.41%
300
1,628
899 out of 1,628 to receive 100 Shares
18.41%
400
1,333
981 out of 1,333 to receive 100 Shares
18.40%
500
1,637
1,506 out of 1,637 to receive 100 Shares
18.40%
600
561
100 Shares plus 58 out of 561 to receive additional 100 Shares
18.39%
700
277
100 Shares plus 79 out of 277 to receive additional 100 Shares
18.36%
800
344
100 Shares plus 161 out of 344 to receive additional 100 Shares
18.35%
900
246
100 Shares plus 160 out of 246 to receive additional 100 Shares
18.34%
1,000
3,401
100 Shares plus 2,836 out of 3,401 to receive additional 100 Shares
18.34%
2,000
1,576
300 Shares plus 1,052 out of 1,576 to receive additional 100 Shares
18.34%
3,000
611
500 Shares plus 306 out of 611 to receive additional 100 Shares
18.34%
4,000
367
700 Shares plus 123 out of 367 to receive additional 100 Shares
18.34%
5,000
387
900 Shares plus 65 out of 387 to receive additional 100 Shares
18.34%
6,000
204
1,100 Shares
18.33%
7,000
116
1,200 Shares plus 96 out of 116 to receive additional 100 Shares
18.33%
8,000
135
1,400 Shares plus 89 out of 135 to receive additional 100 Shares
18.32%
9,000
117
1,600 Shares plus 57 out of 117 to receive additional 100 Shares
18.32%
10,000
837
1,800 Shares plus 267 out of 837 to receive additional 100 Shares
18.32%
20,000
400
3,600 Shares plus 256 out of 400 to receive additional 100 Shares
18.32%
30,000
160
5,400 Shares plus 153 out of 160 to receive additional 100 Shares
18.32%
40,000
121
7,300 Shares plus 33 out of 121 to receive additional 100 Shares
18.32%
50,000
281
9,100 Shares plus 168 out of 281 to receive additional 100 Shares
18.32%
100,000
149
18,300 Shares plus 26 out of 149 to receive additional 100 Shares
18.32%
35,541
Total number of Pool A successful applicants: 18,463

<<<PAGE 22>>>
22
NO. OF 
SHARES
APPLIED 
FOR
NO. OF VALID
APPLICATIONS
BASIS OF ALLOTMENT/BALLOT
APPROXIMATE 
PERCENTAGE 
ALLOTTED OF 
THE TOTAL 
NO. OF SHARES 
APPLIED FOR
POOL B
150,000
92
25,800 Shares plus 28 out of 92 to receive additional 100 Shares
17.22%
200,000
35
34,400 Shares plus 14 out of 35 to receive additional 100 Shares
17.22%
250,000
47
43,000 Shares plus 23 out of 47 to receive additional 100 Shares
17.22%
500,000
15
86,100 Shares
17.22%
750,000
5
129,100 Shares plus 2 out of 5 to receive additional 100 Shares
17.22%
1,000,000
9
172,200 Shares
17.22%
1,500,000
1
258,300 Shares
17.22%
1,750,000
1
301,300 Shares
17.22%
2,250,000
1
387,400 Shares
17.22%
3,000,000
3
516,600 Shares
17.22%
13,999,600
1
2,410,700 Shares
17.22%
210
Total number of Pool B successful applicants: 210
As of the date of this announcement, the relevant subscription monies previously deposited in the 
designated nominee accounts have been remitted back to the accounts of all HKSCC participants. 
Investors should contact their relevant brokers for any inquiries.
COMPLIANCE WITH LISTING RULES AND GUIDANCE
The Directors confirm that, except for the Listing Rules that have been waived and/or in respect of 
which consent has been obtained, the Company has complied with the Listing Rules and guidance 
materials in relation to the placing, allotment and listing of the Class B Shares.
The Directors confirm that, to the best of their knowledge, the consideration paid by the placees 
or the public (as the case may be) directly or indirectly for each Offer Share subscribed for or 
purchased by them is the same as the Offer Price in addition to any brokerage, AFRC transaction 
levy, SFC transaction levy and Stock Exchange trading fee payable.